12 14	Carol M. Baldwin gave birth to William Joseph Baldwin at Massapequa on 21 February 1963 .
12 14	Rosa Antonia Cassimati gave birth to Patrick Lafcadio Hearn at Lefkada on 27 June 1850 .
12 14	Mary Augusta Hickey gave birth to Joseph Patrick Kennedy at Boston on 06 September 1888 .
17 19	Princess Marina, Duchess of Kent gave birth to Michael George Charles Franklin of Kent at Coppins on 04 July 1942 .
12 14	Sharon Thomas gave birth to Dean George Tanaka at Mount Clemens on 31 July 1966 .
11 13	Jobeda Khatun gave birth to Humayun Kabir at Munshiganj District on 28 April 1947 .
13 15	Patricia Ann Whitaker gave birth to John Samuel Waters Jr. at Baltimore on 22 April 1946 .
12 14	Phyllis Jaffé gave birth to Simon Jonathan Sebag Montefiore at London on 27 June 1965 .
12 14	Elizabeth Macy Staton gave birth to Matthew Staton Bomer at Missouri on 11 October 1977 .
11 13	Lorraine Copeland gave birth to Stewart Armstrong Copeland at Alexandria on 16 July 1952 .
14 16	Jacqueline Kennedy Onassis gave birth to John Fitzgerald Kennedy, Jr. at Washington, D.C. on 25 November 1960 .
12 14	Nina J. Loeb gave birth to James Paul Warburg at Hamburg on 18 August 1896 .
11 13	Gloria Vanderbilt gave birth to Anderson Hays Cooper at Manhattan on 03 June 1967 .
11 13	Hilda Shriver gave birth to Robert Sargent Shriver at Westminster on 09 November 1915 .
12 14	Estelle Cummings gave birth to John William Cummings at Long Island on 08 October 1948 .
11 13	Maye Musk gave birth to Elon Reeve Musk at Pretoria on 28 June 1971 .
10 12	Gerda Sutton gave birth to Toni Leicester at Montreal on 30 August 1948 .
12 14	Katherine Jackson gave birth to Jermaine La Jaune Jackson at Gary on 11 December 1954 .
13 15	Harriet Evelyn Brown gave birth to Lloyd Vernet Bridges at San Leandro on 15 January 1913 .
11 13	Judy Murray gave birth to Jamie Robert Murray at Dunblane on 13 February 1986 .
12 14	Marion Ross gave birth to James Ross Meskimen at Los Angeles on 10 September 1959 .
11 13	Samantha Lewes gave birth to Colin Lewes Dillingham at Sacramento on 24 November 1977 .
12 14	Diane Hegarty gave birth to Zeena Galatea LaVey at San Francisco on 19 November 1963 .
10 12	Frances Trollope gave birth to Anthony Trollope at London on 24 April 1815 .
17 19	Mary, Crown Princess of Denmark gave birth to Josephine Sophia Ivalo Mathilda of Denmark at Copenhagen on 08 January 2011 .
17 19	Mary, Crown Princess of Denmark gave birth to Josephine Sophia Ivalo Mathilda of Denmark at Rigshospitalet on 08 January 2011 .
12 14	Juliet Overing Boit gave birth to Julian Russell Sturgis at Boston on 21 October 1848 .
11 13	Carol Jones gave birth to Alexander Emerick Jones at Dallas on 11 February 1974 .
11 13	Katherine Jackson gave birth to Marlon David Jackson at Gary on 12 March 1957 .
14 16	Eliza Riddle Field gave birth to Mary Katherine Keemle Field at St. Louis on 01 October 1838 .
15 17	Alice Nimmo gave birth to Oscar Greeley Clendenning Hammerstein II at New York City on 12 July 1895 .
12 14	Jane Ferguson gave birth to Booker Taliaferro Washington at Hale\'s Ford on 05 April 1856 .
13 15	Mod Bunnag gave birth to Phra Ong Chao Aphakon Kiattiwong at Bangkok on 19 December 1880 .
13 15	Adah Mary Weston gave birth to John Charles Walsham Reith at Stonehaven on 20 July 1889 .
13 15	Mollie Arvelle Bays gave birth to Alvin Pleasant Delaney Carter at Virginia on 15 December 1891 .
12 14	Florence O\'Callaghan gave birth to Laurence Sydney Brodribb Irving at London on 21 December 1871 .
12 14	Alison Comish Thorne gave birth to Kip Stephen Thorne at Logan on 01 June 1940 .
11 13	Hattie Harris gave birth to Roy Harris Jenkins at Monmouthshire on 11 November 1920 .
12 14	Lily Potter gave birth to Harry James Potter at Godric’s Hollow on 31 July 1980 .
11 13	Oriales Rubio gave birth to Marco Antonio Rubio at Miami on 28 May 1971 .
13 15	Lucille Ball gave birth to Desiderio Alberto Arnaz IV at Los Angeles on 19 January 1953 .
12 14	Mary Behenna gave birth to John Henry Brodribb at Keinton Mandeville on 06 February 1838 .
12 14	Nancy Dow gave birth to Jennifer Joanna Aniston at Sherman Oaks on 11 February 1969 .
12 14	Grace M Osterkamp gave birth to Harold Clifford Keel at Gillespie on 13 April 1919 .
13 15	Louise Este Bruce gave birth to David Kirkpatrick Este Bruce at Baltimore on 12 February 1898 .
14 16	Emma Lucretia Dobbin gave birth to Joseph Thomas Sheridan Le Fanu at Dublin on 28 August 1814 .
14 16	Samira Khashoggi gave birth to Emad El-Din Mohamed Abdel Muna\'im Al-Fayed at Alexandria on 15 April 1955 .
11 13	Charlotte Shelby gave birth to Margaret Reilly at San Antonio on 16 June 1900 .
11 13	Janie Ralli gave birth to Marie Evelyn Byng at London on 11 January 1870 .
10 12	Frances Ligonier gave birth to Mary Balfour at Barra on 01 November 1778 .
12 14	Olive Grace Hayter gave birth to Martin Hayter Short at Hamilton on 26 March 1950 .
11 13	Cecilia Gibbs gave birth to Cecilia May Gibbs at Sydenham on 17 January 1877 .
11 13	Cecilia Gibbs gave birth to Cecilia May Gibbs at Kent on 17 January 1877 .
12 14	Doria Ragland gave birth to Rachel Meghan Markle at Canoga Park on 04 August 1981 .
12 14	Doria Ragland gave birth to Rachel Meghan Markle at Los Angeles on 04 August 1981 .
13 15	Laura Low Harriman gave birth to Anne Harriman at New York City on 17 February 1861 .
14 16	Angelica Livingston Morgan gave birth to Geraldine Livingston Morgan at New York City on 02 March 1872 .
10 12	Pru Goward gave birth to Kate Fischer at Adelaide on 30 November 1973 .
13 15	Charlotte Lesher gave birth to Mitchel Lee Hyman at New York City on 15 July 1954 .
11 13	Jennie Williams gave birth to Mildred Mary Petre at Margaretting on 10 November 1895 .
11 13	Jennie Williams gave birth to Mildred Mary Petre at Chelmsford on 10 November 1895 .
11 13	Jessi Colter gave birth to Waylon Albright Jennings at Nashville on 19 May 1979 .
14 16	Rosalind Joan Thompson gave birth to Daniel Chatto St. George Sproule at London on 22 April 1957 .
22 24	Archduchess Maria Anna of Austria gave birth to Princess Alicia Maria Teresa Francesca Luisa Pia Anna Valeria of Bourbon-Parma at Vienna on 13 November 1917 .
11 13	Mary Newton gave birth to George Brydges Rodney at Walton-on-Thames on 13 February 1718 .
11 13	Mary Newton gave birth to George Brydges Rodney at Walton-on-Thames on 13 February 1719 .
12 14	Sarah Jane Anne Lane gave birth to John Bowring at Exeter on 17 October 1792 .
11 13	Alice Hogg gave birth to Douglas McGarel Hogg at London on 28 February 1872 .
14 16	Mussee Lysberg gave birth to Anthony Perrinott Lysberg Barber at Kingston upon Hull on 04 July 1920 .
11 13	Eliza Sullivan gave birth to Timothy Michael Healy at Bantry on 17 May 1855 .
12 14	Blanche Vere Guest gave birth to Vere Brabazon Ponsonby at London on 27 October 1880 .
13 15	Vera Brittain gave birth to Shirley Vivian Teresa Brittain Catlin at London on 27 July 1930 .
11 13	Elizabeth Twigg gave birth to Albert Henry Knattriess at Normanton on 08 August 1874 .
12 14	Ida Mabel Limouzin gave birth to Eric Arthur Blair at Motihari on 25 June 1903 .
13 15	Meriel Eve Givan gave birth to Jeremy Richard Streynsham Hunt at London on 01 November 1966 .
14 16	Louisa Hamilton, Duchess of Abercorn gave birth to George Francis Hamilton at Dublin on 17 December 1845 .
12 14	Eva Blaxley gave birth to Robert Michael Maitland Stewart at Bromley on 06 November 1906 .
12 14	Eleanor Isabel Dalyell gave birth to Thomas Dalyell Loch at Edinburgh on 09 August 1932 .
13 15	Hannah More Macaulay gave birth to George Otto Trevelyan at Rothley Temple on 20 July 1838 .
12 14	Clara Jane Simpson gave birth to Herbert Austin at Little Missenden on 08 November 1866 .
19 21	Donna Maria Aloysia Paula Bonici-Mompalao gave birth to Gerald Paul Joseph Cajetan Carmel Antony Martin Strickland at Valletta on 24 May 1861 .
12 14	Mary Elizabeth Haldane gave birth to Richard Burdon Haldane at Edinburgh on 30 July 1856 .
12 14	Ursula Norton-Griffiths gave birth to John Jeremy Thorpe at South Kensington on 29 April 1929 .
12 14	Margaret Garrett gave birth to Alfred William Fortescue Knox at Ulster on 30 October 1870 .
14 16	Sheila Margaret Burke Roche gave birth to Patrick Barnabas Burke Mayhew at Cookham on 11 September 1929 .
10 12	Elizabeth Maxwell gave birth to William Stirling at Kirkintilloch on 08 March 1818 .
13 15	Dorothy Hope Franklyn gave birth to George Edward Peter Thorneycroft at Dunston on 26 July 1909 .
12 14	Lavender de Grey gave birth to Edward Henry Garnier at Wuppertal on 26 October 1952 .
11 13	Catherine Gurney gave birth to Thomas Fowell Buxton at London on 26 January 1837 .
12 14	Beatrice Ellen Read gave birth to Hastings Lionel Ismay at Nainital on 21 June 1887 .
13 15	Katherine Edith Sadleir gave birth to David Richard Beatty at County Wexford on 17 January 1871 .
13 15	Anne Potter gave birth to William George Armstrong at Newcastle upon Tyne on 26 November 1810 .
13 15	Anne Potter gave birth to William George Armstrong at Newcastle upon Tyne on 26 November 1810 .
15 17	Anne Parsons, Countess of Rosse gave birth to Antony Charles Robert Armstrong-Jones at Belgravia on 07 March 1930 .
12 14	Lady Agnes Duff gave birth to Alfred Duff Cooper at London on 22 February 1890 .
14 16	Lady Doreen Buxton gave birth to Hugh Denis Charles FitzRoy at Cape Town on 03 April 1919 .
11 13	Penelope Cooke gave birth to James Thomas Brudenell at Hambleden on 16 October 1797 .
12 14	Gloria Rose Fallon gave birth to James Thomas Fallon at Brooklyn on 19 September 1974 .
10 12	Melek Hanim gave birth to Frederick Millingen at Constantinople on 01 January 1836 .
11 13	Catherine Dupré gave birth to Francis Wallace Grenfell at Swansea on 29 April 1841 .
12 14	Enid Snelling gave birth to Ann Elizabeth Oldfield Havers at Buckinghamshire on 10 August 1933 .
11 13	Anne Ashley gave birth to Anthony Ashley Cooper at Dorset on 22 July 1621 .
12 14	Pebe Sebert gave birth to Kesha Rose Sebert at Los Angeles on 01 March 1987 .
14 16	Rosalind Hamilton, Duchess of Abercorn gave birth to James Edward Hamilton at London on 29 February 1904 .
11 13	Elizabeth Guinness gave birth to Edward Cecil Guinness at Dublin on 10 November 1847 .
12 14	Emma Richards gave birth to John Theodore Cuthbert Moore-Brabazon at London on 08 February 1884 .
13 15	Gertrude Isabella Batson gave birth to Basil Stanlake Brooke at County Fermanagh on 09 June 1888 .
12 14	Ethel Mary Schuster gave birth to Helen Mary Wilson at Winchester on 14 April 1924 .
12 14	Amy Randolph Simcocks gave birth to Charles Randolph Quirk at Michael on 12 July 1920 .
14 16	Andrée Belden Maitland gave birth to Howard Brush Dean III at East Hampton on 17 November 1948 .
14 16	Katharine Russell, Viscountess Amberley gave birth to Bertrand Arthur William Russell at Trellech on 18 May 1872 .
12 14	Patricia Mary Bedford gave birth to Peter Michael Ainsworth at Wokingham on 16 November 1956 .
11 13	Jane Grey gave birth to Thomas George Baring at London on 22 January 1826 .
11 13	Dodie Brando gave birth to Marlon Brando Junior at Omaha on 03 April 1924 .
11 13	Pattie Mallette gave birth to Justin Drew Bieber at London on 01 March 1994 .
10 12	Ola Hudson gave birth to Saul Hudson at Hampstead on 23 July 1965 .
14 16	Charlotte Mary Bowater gave birth to Damian Watcyn Lewis at St John\'s Wood on 11 February 1971 .
12 14	Georgina B. Long gave birth to Harold Martin Burrough at Herefordshire on 04 July 1889 .
10 12	Janet Woodrow gave birth to Woodrow Wilson at Staunton on 28 December 1856 .
12 14	Janet Woodrow gave birth to Woodrow Wilson at Woodrow Wilson Birthplace on 28 December 1856 .
12 14	Katherine Medill McCormick gave birth to Robert Rutherford McCormick at Chicago on 30 July 1880 .
12 14	Katherine Medill McCormick gave birth to Robert Rutherford McCormick at Chicago on 01 January 1880 .
13 15	Mary Simmerson Cunningham Logan gave birth to Mary Elizabeth Logan at Benton on 20 June 1858 .
13 15	Jo Anne Moore gave birth to John Warnock Hinckley Jr. at Ardmore on 29 May 1955 .
12 14	Melanie Sloan gave birth to Scarlett Ingrid Johansson Sloan at Manhattan on 22 November 1984 .
12 14	Blythe Danner gave birth to Gwyneth Kate Paltrow at Los Angeles on 27 September 1972 .
15 17	Anne, Princess Royal gave birth to Peter Mark Andrew Phillips at St. Mary\'s Hospital on 15 November 1977 .
12 14	Helen Gray Huntington gave birth to Helen Dinsmore Huntington at Manhattan on 09 April 1893 .
12 14	May Bunny gave birth to Peter Sydney Ernest Aylen at London on 07 September 1923 .
14 16	Mary Williamson Averell gave birth to William Averell Harriman at New York City on 15 November 1891 .
10 12	Jean Ross gave birth to Sarah Cockburn at Cheltenham on 27 May 1939 .
12 14	Eliza Ballou gave birth to James Abram Garfield at Moreland Hills on 19 November 1831 .
12 14	Lorraine Copeland gave birth to Miles Axe Copeland III at London on 02 May 1944 .
10 12	Anne Rowling gave birth to Joanne Rowling at Yate on 31 July 1965 .
11 13	Alice Kipling gave birth to Joseph Rudyard Kipling at Mumbai on 30 December 1865 .
12 14	Mary Walmesley gave birth to Francis William Petre at Lower Hutt on 27 August 1847 .
11 13	Clara T. Bracy gave birth to Sidney Bracy at Melbourne on 18 December 1877 .
13 15	Hannah Simpson Grant gave birth to Hiram Ulysses Grant at Point Pleasant on 27 April 1822 .
13 15	Laure Murat gave birth to René Murat Auberjonois at New York City on 01 June 1940 .
13 15	Sara Sothern gave birth to Elizabeth Rosemond Taylor at Hampstead Garden Suburb on 27 February 1932 .
11 13	Charlotte Lydia Whiting gave birth to Charlotte Garrigue at Brooklyn on 20 November 1850 .
11 13	Charlotte Lydia Whiting gave birth to Charlotte Garrigue at Brooklyn on 28 November 1850 .
11 13	Katherine Jackson gave birth to Steven Randall Jackson at Gary on 29 October 1961 .
13 15	Clarisa Margaret Boehmer gave birth to Agatha Mary Clarissa Miller at Torquay on 15 September 1890 .
11 13	Gujrati Devi gave birth to Rajnath Singh at Chandauli district on 10 July 1951 .
16 18	Anne Dalrymple gave birth to Lady Anne Barnard, Lady Barnard, Anne Lindsay at Balcarres House on 12 December 1750 .
11 13	Anne Neal gave birth to Stephen Grover Cleveland at Caldwell on 18 March 1837 .
13 15	Hulda Randall Minthorn gave birth to Herbert Clark Hoover at West Branch on 10 August 1874 .
11 13	Marie Bourassa gave birth to Maurice Robert Gravel at Springfield on 13 May 1930 .
11 13	Mary O\'Dwyer gave birth to Timothy Carew O\'Brien at Dublin on 05 November 1861 .
11 13	Marian Andrew gave birth to Richard Treat Williams at Rowayton on 01 December 1951 .
13 15	Phoebe Elizabeth Dickerson gave birth to Warren Gamaliel Harding at Blooming Grove on 02 November 1865 .
11 13	Ann Drummond McEwan gave birth to Abraham Bailey at Cradock on 06 November 1864 .
12 14	Ann Drummond McEwan gave birth to Abraham Bailey at Cape Colony on 06 November 1864 .
13 15	Lady Charlotte Cavendish-Bentinck gave birth to Charles Cavendish Fulke Greville at London on 02 April 1794 .
12 14	Jane Etta Hillhouse gave birth to William Bradley Pitt at Shawnee on 18 December 1963 .
13 15	Anna Maria Isabella Fynes-Clinton gave birth to Hubert Hastings Parry at Bournemouth on 27 February 1848 .
11 13	Ann Astaire gave birth to Adele Marie Austerlitz at Omaha on 10 September 1896 .
10 12	Kim Zimmer gave birth to Jacob Weary at Trenton on 14 February 1990 .
11 13	Malvina Stone gave birth to Chester Alan Arthur at Fairfield on 05 October 1829 .
12 14	Bertha Ida Gordy gave birth to Berry Gordy III at Detroit on 28 November 1929 .
12 14	Julia McConnell gave birth to Addison Mitchell McConnell Jr. at Sheffield on 20 February 1942 .
12 14	Julia McConnell gave birth to Addison Mitchell McConnell Jr. at Tuscumbia on 20 February 1942 .
13 15	Rosa Florentina Eroles gave birth to Francis Ysidro Edgeworth at County Longford on 08 February 1845 .
12 14	Sarah Cathcart gave birth to Charles Leonard Woolley at Upper Clapton on 17 April 1880 .
12 14	Thelma Leeds gave birth to Albert Lawrence Brooks at Beverly Hills on 22 July 1947 .
11 13	Sophia Birchard gave birth to Rutherford Birchard Hayes at Fremont on 04 October 1822 .
11 13	Sophia Birchard gave birth to Rutherford Birchard Hayes at Delaware on 04 October 1822 .
11 13	Deborah Catesby gave birth to Christopher Catesby Harington at Acton on 26 December 1986 .
12 14	Cynthia Lennon gave birth to John Charles Julian Lennon at Liverpool on 08 April 1963 .
11 13	Angela Thorne gave birth to Rupert William Penry-Jones at London on 22 September 1970 .
10 12	Dorothy Sanders gave birth to Bernard Sanders at Brooklyn on 08 September 1941 .
12 14	Christine Ann Assange gave birth to Julian Paul Hawkins at Townsville on 03 July 1971 .
12 14	Madam C. J. Walker gave birth to Lelia McWilliams at Vicksburg on 06 June 1885 .
12 14	Victoria Josephine Moor gave birth to John Calvin at Plymouth Notch on 04 July 1872 .
12 14	Theodate Page Price gave birth to Herman Webster Mudgett at Gilmanton on 16 May 1861 .
13 15	Odessa Grady Clay gave birth to Cassius Marcellus Clay, Jr. at Louisville on 17 January 1942 .
11 13	Grace Spear gave birth to Charles Samuel Addams at Westfield on 07 January 1912 .
13 15	Crystal Lee Jackson gave birth to Joseph Walter Jackson at Fountain Hill on 26 July 1928 .
12 14	Linda Miller gave birth to Jason Patric Miller Jr. at Queens on 17 June 1966 .
11 13	Tina Knowles gave birth to Beyonce Giselle Knowles at Houston on 04 September 1981 .
11 13	Abby May gave birth to Anna Bronson Alcott at Philadelphia on 16 March 1831 .
11 13	Elizabeth Rees-Williams gave birth to Jared Francis Harris at London on 24 August 1961 .
10 12	Cassandra Austen gave birth to Jane Austen at Steventon on 16 December 1775 .
11 13	Katherine Tisch gave birth to Edwin John Fisher at Philadelphia on 10 August 1928 .
12 14	Ellen Frances Price gave birth to John Lighton Synge at Dublin on 23 March 1897 .
12 14	Mary Ruth Parker-Brooke gave birth to Rupert Chawner Brooke at Rugby on 03 August 1887 .
12 14	Mary Ruth Parker-Brooke gave birth to Rupert Chawner Brooke at Rugby on 01 January 1887 .
13 15	Julia Fuller Clark gave birth to Richard Wagstaff Clark at Mount Vernon on 30 November 1929 .
11 13	Marichen Altenburg gave birth to Henrik Johan Ibsen at Skien on 20 March 1828 .
11 13	Vivienne Bellisario gave birth to Sean Harland Murray at Bethesda on 15 November 1977 .
12 14	Michelle Phillips gave birth to Gilliam Chynna Phillips at Los Angeles on 12 February 1968 .
18 20	Diana, Princess of Wales gave birth to William Arthur Philip Louis of Wales at St. Mary\'s Hospital on 21 June 1982 .
11 13	Mary Henn gave birth to Charles Villiers Stanford at Dublin on 01 January 1852 .
11 13	Mary Henn gave birth to Charles Villiers Stanford at Dublin on 30 September 1852 .
10 12	Margaret Winlowe gave birth to Francis Bernard at Brightwell-cum-Sotwell on 12 July 1712 .
15 17	Virginia Admiral gave birth to Robert Anthony De Niro Jr at New York City on 17 August 1943 .
13 15	Mary Constance Wyndham gave birth to Cynthia Mary Evelyn Charteris at Wiltshire on 27 September 1887 .
13 15	Helen Johanna Lawrence gave birth to Alfred Alexander Gordon Clark at Surrey on 01 January 1900 .
13 15	Helen Johanna Lawrence gave birth to Alfred Alexander Gordon Clark at Surrey on 04 September 1900 .
17 19	Lady Mary Campbell gave birth to Richard Plantagenet Campbell Temple-Nugent-Brydges-Chandos-Grenville, Earl Temple at Westminster St James on 10 September 1823 .
11 13	Tabitha King gave birth to Joseph Hillstrom King at Hermon on 04 June 1972 .
11 13	Tabitha King gave birth to Joseph Hillstrom King at Bangor on 04 June 1972 .
11 13	Tabitha King gave birth to Joseph Hillstrom King at Maine on 04 June 1972 .
12 14	Julia Ward Howe gave birth to Florence Marion Howe at Boston on 01 January 1845 .
12 14	K. C. Groom gave birth to Denise Naomi Klein at London on 01 February 1897 .
13 15	Mary Lee Pfeiffer gave birth to Thomas Cruise Mapother IV at Syracuse on 03 July 1962 .
13 15	Mary Lee Pfeiffer gave birth to Thomas Cruise Mapother IV at Syracuse on 30 July 1962 .
11 13	Ivana Trump gave birth to Donald John Trump at Manhattan on 31 December 1977 .
12 14	Betty Sue Wells gave birth to John Christopher Depp at Owensboro on 09 June 1963 .
12 14	Vanessa Hubbard gave birth to Gabriella Zanna Vanessa Anstruther-Gough-Calthorpe at Basingstoke on 08 April 1989 .
12 14	Katherine Florence Barman gave birth to Adrian Cedric Boult at Chester on 08 April 1889 .
11 13	Ivana Trump gave birth to Eric Frederick Trump at Manhattan on 06 January 1984 .
18 20	Princess Michael of Kent gave birth to Frederick Michael George David Louis Windsor at St. Mary\'s Hospital on 06 April 1979 .
11 13	Julia Ogilvy gave birth to Flora Alexandra Ogilvy at Edinburgh on 15 December 1994 .
11 13	Julia Ogilvy gave birth to Alexander Charles Ogilvy at Seafield on 12 November 1996 .
19 21	Sylvana Windsor, Countess of St Andrews gave birth to Amelia Sophia Theodora Mary Margaret Windsor at Rosie Hospital on 24 August 1995 .
11 13	Janelle Kidman gave birth to Nicole Mary Kidman at Honolulu on 20 June 1967 .
13 15	Rose Samson Hart gave birth to Herbert Lionel Adolphus Hart at Harrogate on 18 July 1907 .
12 14	Elizabeth Christ gave birth to Frederick Christ Trump at The Bronx on 11 October 1905 .
11 13	Elizabeth Sale gave birth to Garret Colley at County Meath on 19 July 1735 .
13 15	Katherine Lowthian gave birth to Isaac Lowthian Bell at Newcastle upon Tyne on 18 February 1816 .
13 15	Katherine Lowthian gave birth to Isaac Lowthian Bell at Newcastle upon Tyne on 15 February 1816 .
13 15	Charlotte Champe Stearns gave birth to Thomas Stearns Eliot at St. Louis on 26 September 1888 .
14 16	Eliza Susan Morton Quincy gave birth to Anna Cabot Lowell Quincy at Boston on 27 June 1812 .
11 13	Elizabeth Cranch gave birth to Richard Hussey Vivian at Truro on 28 July 1775 .
15 17	Amy Phyllis Ivy Felicity Whittaker gave birth to John Kilian Houston Brunner at Wallingford on 24 September 1934 .
12 14	Dos Peanh gave birth to Lau Kim Lorn at Voat Kor on 07 July 1926 .
10 12	Minnie Marx gave birth to Leonard Marx at Manhattan on 22 March 1887 .
13 15	Marion Evelyn Dickens gave birth to Harry Charles Salusbury Lloyd at London on 17 November 1983 .
11 13	Wendy Hoyte gave birth to Gavin Andrew Hoyte at Leytonstone on 06 June 1990 .
12 14	Frances Jane Lutwidge gave birth to Charles Lutwidge Dodgson at Daresbury on 27 January 1832 .
12 14	Irmelin DiCaprio gave birth to Leonardo Wilhelm DiCaprio at Los Angeles on 11 November 1974 .
12 14	Marcia Jeannine Jacobson gave birth to Daniel Jacob Radcliffe at Hammersmith on 23 July 1989 .
13 15	Jessica MacMaster gave birth to Edward Bridge Danson III at San Diego on 29 December 1947 .
11 13	Catherine Adams gave birth to Helen Adams Keller at Tuscumbia on 27 June 1880 .
10 12	Fede Belini gave birth to Laura Archera at Turin on 02 November 1911 .
12 14	Achsah Ridgely gave birth to Charles Ridgely Carnan at Baltimore County on 06 December 1760 .
12 14	Elizabeth Dorothy Rundall gave birth to Ernest Dunlop Swinton at Bengaluru on 21 October 1868 .
10 12	Anna Folger gave birth to Martha Coffin at Boston on 25 December 1806 .
17 19	Catherine, Duchess of Cambridge gave birth to Louis Arthur Charles of Cambridge at St. Mary\'s Hospital on 23 April 2018 .
10 12	Kōnia gave birth to Bernice Pauahi Pākī at Pākī on 19 December 1831 .
12 14	Janina Milosz gave birth to Anthony Oscar Milosz at Washington, D.C. on 29 March 1947 .
12 14	Janina Milosz gave birth to John Peter Milosz at Washington, D.C. on 22 January 1951 .
12 14	Helen Frances Warren gave birth to Francis Warren Pershing at Cheyenne on 24 June 1909 .
11 13	Mary Soames gave birth to Nicholas Winston Soames at Croydon on 12 February 1948 .
13 15	Neneh Cherry gave birth to Mabel Alabama-Pearl McVey at Alhaurín el Grande on 20 February 1996 .
14 16	Lady Elizabeth Graham-Toler gave birth to Harold Rupert Leofric George Alexander at London on 10 December 1891 .
11 13	Beatrice Stone gave birth to Robert Allen Zimmerman at Duluth on 24 May 1941 .
11 13	Olive Hamilton gave birth to John Ernest Steinbeck at Salinas on 27 February 1902 .
11 13	Margaret Majer gave birth to Grace Patricia Kelly at Philadelphia on 12 November 1929 .
11 13	Helen Wauchope gave birth to Alicia Ann Spottiswoode at Lauder on 24 June 1810 .
11 13	Mary Allen gave birth to Jonathan Wathen Phipps at London on 06 October 1769 .
11 13	Phyllis Piper gave birth to Michael Andrew Fox at Edmonton on 09 June 1961 .
13 15	Deborah Sue Davisson gave birth to Michael Fred Phelps II at Baltimore on 30 June 1985 .
13 15	June Frances Nicholson gave birth to John Joseph Nicholson at Neptune City on 22 April 1937 .
11 13	Nellie Pillsbury gave birth to Stephen Edwin King at Portland on 21 September 1947 .
13 15	Jackie Stallone gave birth to Michael Sylvester Gardenzio Stallone at Hell\'s Kitchen on 06 July 1946 .
12 14	Martha Ross gave birth to Jonathan Stephen Ross at St Pancras on 17 November 1960 .
11 13	Janice Winblad gave birth to Cynthia Ann Nicolich at Queens on 12 December 1960 .
11 13	Belle Simon gave birth to Paul Frederick Simon at Newark on 13 October 1941 .
11 13	Lucy Charendoff gave birth to Tara Lyn Charendoff at Toronto on 12 February 1973 .
12 14	Anna Johnson gave birth to Lucille Fay LeSueur at San Antonio on 23 March 1904 .
12 14	Betty Lou Bredemus gave birth to Julia Fiona Roberts at Smyrna on 28 October 1967 .
11 13	Mary Brown gave birth to Marion Robert Morrison at Winterset on 26 May 1907 .
11 13	Sally Ramshaw gave birth to Heath Andrew Ledger at Perth on 04 April 1979 .
12 14	Guadelupe Rodriguez gave birth to Jennifer Lynn Lopez at The Bronx on 24 July 1969 .
15 17	Louise Melanie de Belzim gave birth to Colville Adrian de Rune Barclay at Paris on 17 September 1869 .
