12 14	Amice de Clare gave birth to Isabel de Redvers at England on 01 January 1237 .
12 14	Amice de Clare gave birth to Isabel de Redvers at England on 01 July 1237 .
13 15	Jillian Fink gave birth to Corey Parker Haas at New York City on 08 July 1965 .
12 14	Corinne Roosevelt Robinson gave birth to Corinne Douglas Robinson at Orange on 02 July 1886 .
11 13	Alethia Villey gave birth to Mary Cyrene Burch at Georgetown on 16 August 1826 .
13 15	Beryl Te Wiata gave birth to Heather Rima Te Wiata at London on 01 January 1963 .
11 13	Elinor Morgenthau gave birth to Robert Morris Morgenthau at Manhattan on 31 July 1919 .
11 13	Grace Purves gave birth to David Milne at East Lothian on 01 January 1805 .
12 14	Jean Grizel McMicking gave birth to Matthew Clive Pinsent at Holt on 10 October 1970 .
13 15	Mary Maxwell Gates gave birth to William Henry Gates III at Seattle on 28 October 1955 .
10 12	Juanita Guccione gave birth to Djelloul Mabrouk at Algiers on 01 January 1934 .
12 14	Julia Matilda Waley gave birth to Dorothea Waley Cohen at London on 17 December 1882 .
15 17	Emily Dow Partridge gave birth to Joseph Don Carlos Young at Salt Lake City on 06 May 1855 .
12 14	Blanche DeLoosey gave birth to Blanche Marie Louise Oelrichs at Newport on 01 October 1890 .
12 14	Margot Asquith gave birth to Elizabeth Charlotte Lucy Asquith at London on 26 February 1897 .
13 15	Ethel Jane Foster gave birth to Donough Edward Foster O\'Brien at London on 05 January 1897 .
12 14	Flavia Camp Canfield gave birth to Dorothea Frances Canfield at Lawrence on 17 February 1879 .
10 12	Katherine Chamberlain gave birth to Elizabeth Harman at London on 30 August 1906 .
17 19	Mrs Henry de la Pasture gave birth to Edmée Elizabeth Monica de la Pasture at Steyning on 09 June 1890 .
10 12	Hester Seys gave birth to Mary Darby at Bristol on 27 November 1758 .
12 14	Mary Frances Fitzgerald gave birth to Edward Marlborough Purcell at Woodbridge on 31 March 1809 .
12 14	Marjorie Thomas gave birth to Noel John Christopher Harrison at Kensington on 29 January 1934 .
11 13	Ada Norris gave birth to Rosemary Anne Norris at Melbourne on 15 September 1933 .
14 16	Inga Karoline Eldora Pedersen gave birth to Eddie August Henry Schneider at Manhattan on 20 October 1911 .
12 14	May Sutton gave birth to Dorothy May Bundy at Los Angeles on 01 September 1916 .
12 14	Moyna Macgill gave birth to Edgar George McIldowie Lansbury at London on 12 January 1930 .
14 16	Ethel Roosevelt Derby gave birth to Edith Roosevelt Derby at New York City on 17 June 1917 .
13 15	Margaret Garrett gave birth to Edmund Francis Vesey Knox at County Down on 23 January 1865 .
11 13	Sarah Elizabeth Boothroyd gave birth to Edna Waugh at Shipbourne on 29 June 1879 .
12 14	Diana Ross gave birth to Tracee Joy Silberstein at Los Angeles on 29 October 1972 .
11 13	Laura Delphine Kilpatrick gave birth to Thelma Morgan at Lucerne on 01 January 1904 .
11 13	Laura Delphine Kilpatrick gave birth to Thelma Morgan at Lucerne on 23 August 1904 .
10 12	Jane Broughton gave birth to Edward Osborne at Ashford on 01 January 1530 .
12 14	Susan Cornelia Warren gave birth to Edward Perry Warren at Boston on 08 January 1860 .
11 13	Susanna Fry gave birth to Edward Reynolds Pease at Bristol on 23 December 1857 .
13 15	Catherine Elizabeth Biddulph gave birth to Edwin Lester Linden Arnold at Swanscombe on 14 May 1857 .
13 15	Elizabeth Markham gave birth to Charles Edwin Anson Markham at Oregon City on 23 April 1852 .
11 13	Etterlene DeBarge gave birth to Eldra Patrick DeBarge at Detroit on 04 June 1961 .
13 15	Grace Green gave birth to Eleanor Butler Alexander at New York City on 01 January 1888 .
12 14	Marjorie Merriweather Post gave birth to Eleanor Post Close at Greenwich on 03 December 1909 .
14 16	Anna Roosevelt Halsted gave birth to Anna Eleanor Dall at New York City on 25 March 1927 .
11 13	Margaret Furneaux gave birth to Eleanor Furneaux Smith at Birkenhead on 01 January 1902 .
12 14	Ellen Axson Wilson gave birth to Eleanor Randolph Wilson at Middletown on 16 October 1889 .
11 13	Karen Isner gave birth to Jonathan Robert Isner at Greensboro on 26 April 1985 .
12 14	Eliza Frinsham gave birth to Eliza Frinsham at Windsor Great Park on 01 January 1734 .
11 13	Sarah Barrett gave birth to Eliza Lee Cabot at Boston on 15 August 1787 .
13 15	Maria Louisa Kissam gave birth to Eliza Osgood Vanderbilt at Staten Island on 01 January 1860 .
14 16	Emmeline B. Wells gave birth to Elizabeth Ann Wells at Salt Lake City on 07 December 1859 .
11 13	Lynne Cheney gave birth to Elizabeth Lynne Cheney at Madison on 28 July 1966 .
11 13	Lynne Cheney gave birth to Elizabeth Lynne Cheney at Madison on 01 January 1966 .
13 15	Sarah Cleveland gave birth to Elizabeth Clementine Kinney at New York City on 01 January 1810 .
15 17	Mary Elizabeth Catherine A’Court gave birth to Mary Elizabeth Ashe à Court-Repington at Richmond on 21 July 1822 .
11 13	Anne FitzWilliam gave birth to Elizabeth Cooke at Gidea Hall on 01 January 1528 .
11 13	Abby May gave birth to Elizabeth Peabody Alcott at Boston on 24 June 1835 .
13 15	Elizabeth Wooster Stuart Phelps gave birth to Mary Gray Phelps at Boston on 31 August 1844 .
12 14	Agathe Camille de Royer gave birth to Elizabeth Wynne at Folkingham on 19 April 1778 .
12 14	London King gave birth to Tanner Elle Schneider at Los Angeles on 01 January 1989 .
12 14	London King gave birth to Tanner Elle Schneider at Los Angeles on 03 July 1989 .
13 15	Anne Maria Acton gave birth to Bartholomew Eliot George Warburton at Tullamore on 01 January 1810 .
18 20	Catherine Madox Brown gave birth to Joseph Leopold Ford Hermann Madox Hueffer at London Borough of Merton on 17 December 1873 .
11 13	Emily Frances Bowles gave birth to Emilie Baker at Boston on 01 January 1864 .
11 13	June Flewett gave birth to Emma Vallencey Freud at London on 25 January 1962 .
13 15	Agnes Ann Edwards gave birth to George Gilbert Aimé Murray at Sydney on 02 January 1866 .
12 14	Mamie Eisenhower gave birth to John Sheldon Doud Eisenhower at Denver on 03 August 1922 .
12 14	Peggy Lipton gave birth to Rashida Leah Jones at Los Angeles on 25 February 1976 .
12 14	Caroline Douglas gave birth to Francis William Bouverie Douglas at Dumfries on 08 February 1847 .
14 16	Georgina Mary Hill gave birth to Eva Selina Laura Gore-Booth at County Sligo on 22 May 1870 .
12 14	Lady Katharine Carnegie gave birth to Evan Frederick Morgan at London on 13 July 1893 .
14 16	Lady Katharine Carnegie gave birth to The Hon. Evan Frederick Morgan at London on 13 July 1893 .
12 14	Ileana Jacket gave birth to Sonya Eleonora Smith Jacquet at Philadelphia on 23 April 1972 .
12 14	Caroline Medawar Garland gave birth to Alexander Medawar Garland at London on 26 May 1970 .
11 13	Georgine Machozi Nyahengwa gave birth to Amini Cishugi at Bukavu on 13 July 1996 .
12 14	Helen Eliza Garrison gave birth to Helen Frances Garrison at Boston on 16 December 1844 .
11 13	Maria Riva gave birth to John Michael Riva at Manhattan on 28 June 1948 .
13 15	Nancy Sinatra gave birth to Christina Sinatra at United States of America on 20 June 1948 .
12 14	Methyl Gertrude Palfrey gave birth to Sarah Hammond Palfrey at Sharon on 18 September 1912 .
13 15	Sybil Thomas, Viscountess Rhondda gave birth to Margaret Haig Thomas at Bayswater on 12 June 1883 .
12 14	Lita Grey gave birth to Sydney Earle Chaplin at Beverly Hills on 30 March 1926 .
12 14	Lita Grey gave birth to Sydney Earle Chaplin at Beverly Hills on 31 March 1926 .
17 19	Lady Agnes Mary Cecilia Northcote gave birth to Flora Louisa Cecilia MacLeod at 10 Downing Street on 03 January 1878 .
17 19	Lady Agnes Mary Cecilia Northcote gave birth to Flora Louisa Cecilia MacLeod at 10 Downing Street on 03 February 1878 .
11 13	Sadie Chandler Cole gave birth to Florence Cole at Detroit on 17 June 1890 .
14 16	Belle Case La Follette gave birth to Flora Dodge La Follette at Madison on 10 September 1882 .
11 13	Lucy Savage gave birth to John N.B. Villiers-Farrow at Sydney on 10 February 1904 .
12 14	Zelda Fitzgerald gave birth to Frances Scott Fitzgerald at Saint Paul on 26 October 1921 .
12 14	Lucia Gray Swett gave birth to Esther Frances Alexander at Boston on 27 February 1837 .
11 13	Frances Fisher gave birth to Francesca Ruth Fisher-Eastwood at Redding on 07 August 1993 .
11 13	Maratye Bennet gave birth to Abraham Cashow at Oyster Bay on 01 January 1814 .
13 15	Diana Elizabeth Milner gave birth to Francis Hastings Charles Doyle at Tadcaster on 21 August 1810 .
14 16	Ellen Constance Baldock gave birth to Francis Charles Adelbert Henry Needham at Brentford on 26 November 1883 .
13 15	Arabella Matilda Rudkin gave birth to Francis Edward Spring at County Cork on 20 January 1849 .
11 13	Tish Cyrus gave birth to Neil Timothy Helson at Ashland on 24 February 1989 .
11 13	Tish Cyrus gave birth to Noah Lindsey Cyrus at Nashville on 08 January 2000 .
17 19	Sirikit gave birth to Vajiralongkorn Borommachakkrayadisonsantatiwong Thewetthamrongsuboriban Aphikhunuprakanmahittaladunladet Phumiphonnaretwarangkun Kittisirisombunsawangkhawat Borommakhattiyaratchakuman at Amphorn Sathan Residential Hall on 28 July 1952 .
12 14	Clarnell Stage gave birth to Edmund Emil Kemper III at Burbank on 18 December 1948 .
11 13	Hannah Bird gave birth to John Bird Sumner at Kenilworth on 25 February 1780 .
16 18	Hariot Hamilton-Temple-Blackwood, Marchioness of Dufferin and Ava gave birth to Frederick Temple Hamilton-Temple-Blackwood at Ottawa on 26 February 1875 .
12 14	Christa Miller gave birth to Charlotte Sarah Lawrence at Los Angeles on 08 June 2000 .
13 15	Elsa Maria Elisabeth Naslund gave birth to Frideborg Winblad at Anundsjö parish on 18 January 1869 .
11 13	Margaret Willinger gave birth to László Josef Willinger at Germany on 16 April 1909 .
13 15	Jesse Lenore Weir gave birth to Lyndon Hermyle LaRouche Jr. at Rochester on 08 September 1922 .
12 14	Dorothea J. Winterloff gave birth to Dorothea Charlotte Ensko at Manhattan on 12 July 1920 .
14 16	Margaret Cushing Whitman gave birth to Margaret Cushing Whitman at Cold Spring Harbor on 04 August 1956 .
10 12	Miki Haran gave birth to Noa Netanyahu at Massachusetts on 29 April 1978 .
11 13	Tara Strong gave birth to Sammy James Strong at Vancouver on 05 February 2002 .
14 16	Martha Waldron Cowdin gave birth to Gaspar Griswold Bacon, Sr. at Jamaica Plain on 07 March 1886 .
11 13	Audrey Williams gave birth to Randall Hank Williams at Shreveport on 26 May 1949 .
11 13	Alice White gave birth to Eugene Willford Markey at Jackson on 11 December 1895 .
13 15	Hazel Bell Wines gave birth to Genevieve Caroline Wines at Ruby Valley on 15 March 1918 .
15 17	Belle Montrose gave birth to Stephen Valentine Patrick William Allen at New York City on 26 December 1921 .
13 15	"Eliza Anne \""Annarella\"" Warington gave birth to Ellen Philadelphia Smyth at Bedford on 01 January 1828 ."
13 15	Selina Taylor White Prichard gave birth to Alfred Ernest Beamish at Richmond on 06 August 1879 .
12 14	Lady Cecilia Gordon-Lennox gave birth to George Charles Bingham at London on 13 December 1860 .
14 16	Florence Louisa Hemming gave birth to George Arthur Boyd-Rochfort at Middleton Park House on 01 January 1880 .
12 14	Theodosia Spring Rice gave birth to Thomas Morgan Robertson at London on 14 October 1958 .
12 14	Anna Maria Bowyer gave birth to George Limbrey Sclater at London on 19 May 1826 .
12 14	Rachel Emily Wright gave birth to George John Shaw-Lefevre at Battersea on 12 June 1831 .
14 16	Lurleen Brigham Burns Wallace gave birth to George Corley Wallace, III at Eufaula on 17 October 1951 .
12 14	Susanne Klejman gave birth to Michael Farrand Bennet at New Delhi on 28 November 1964 .
13 15	Harriet Leveson-Gower, Countess Granville gave birth to Georgiana Charlotte Leveson-Gower at Staffordshire on 23 September 1812 .
12 14	Lynne Spears gave birth to Jamie Lynn Marie Spears at McComb on 04 April 1991 .
12 14	Malvina Belle Ogden gave birth to Jonathan Ogden Armour at Milwaukee on 11 November 1863 .
11 13	Victoria Aitken gave birth to Kitty Eleanor Spencer at London on 28 December 1990 .
12 14	Ella Margaret Brown gave birth to Girard Brown Henderson at Brooklyn on 25 February 1905 .
16 18	Cornelia Paterson Van Rensselaer gave birth to Euphemia White Van Rensselaer at Manor of Rensselaerswyck on 01 January 1816 .
11 13	Mary McCartney gave birth to Peter Michael McCartney at Liverpool on 07 January 1944 .
11 13	Lillian Gordy Carter gave birth to Gloria Carter at Plains on 22 October 1926 .
13 15	Susan Barrantes gave birth to Sarah Margaret Ferguson at London Welbeck Hospital on 15 October 1959 .
14 16	Karen Bobo gave birth to Holly Lynn Bobo at United States of America on 12 October 1990 .
12 14	Vernita Lee Winfrey gave birth to Oprah Gail Winfrey at Kosciusko on 29 January 1954 .
13 15	Carey Wilson gave birth to Carey Anthony Wilson Jr. at Los Angeles on 02 May 1926 .
15 17	Effie Adelaide Rowlands gave birth to Margherita Cecila Brigida Lucia Maria Albanesi at London on 08 October 1899 .
12 14	Jean Rae Erickson gave birth to Timothy Walter Burton at Burbank on 25 August 1958 .
12 14	Marcheline Bertrand gave birth to James Haven Voight at Los Angeles on 11 May 1973 .
10 12	Julia Warhola gave birth to Andrew Warhola at Pittsburgh on 06 August 1928 .
14 16	Anna Lloyd Jones Wright gave birth to Franklin Lincoln Wright at Richland Center on 08 June 1867 .
12 14	Catherine Temple gave birth to Grenville Temple Emmet at New Rochelle on 02 August 1877 .
12 14	Catherine Temple gave birth to Grenville Temple Emmet at New Rochelle on 28 August 1877 .
10 12	Francis Goodyear gave birth to John Child at London on 01 January 1637 .
13 15	Debbie Nelson gave birth to Marshall Bruce Mathers III at St. Joseph on 17 October 1972 .
11 13	Lillian Grommett gave birth to William Blake Crump at Tulsa on 26 July 1922 .
11 13	Lillian Grommett gave birth to William Blake Crump at Tulsa on 26 June 1922 .
11 13	Lillian Grommett gave birth to William Blake Crump at Tulsa on 01 January 1922 .
14 16	Nicky Downer gave birth to Georgina Mary Beatrice Downer at City of Brussels on 29 September 1979 .
14 16	Alice Edna Zisemann gave birth to August Anheuser Busch II at St. Louis on 28 March 1899 .
14 16	Alice Edna Zisemann gave birth to August Anheuser Busch II at St. Louis on 01 January 1899 .
11 13	Polly Carroll Caton gave birth to Marianne Caton at Baltimore on 01 January 1788 .
13 15	Gladys Rankin gave birth to Sidney Rankin Drew at New York City on 19 September 1891 .
11 13	Susanna Hunnewell gave birth to Horatio Hollis Hunnewell at Watertown on 27 July 1810 .
12 14	Susan Alexander McCook gave birth to Susan Mary Jay at Rome on 19 June 1918 .
12 14	Almira Park Burdg gave birth to Hannah Elizabeth Milhous at Indiana on 07 March 1885 .
13 15	Rosalind Rosoff Beimler gave birth to Hans Anthony Beimler at Mexico City on 10 July 1953 .
10 12	Elizabeth Stamford gave birth to Anne Caldwell at Staffordshire on 01 January 1799 .
10 12	Elizabeth Stamford gave birth to Anne Caldwell at Staffordshire on 01 January 1791 .
12 14	Grey Griffin gave birth to Jefferson Texas Hammond at Los Angeles on 31 January 2007 .
11 13	Andrea Nako Koci gave birth to Amanda Koci at Milwaukee on 16 February 1994 .
12 14	Catherine Gordon Byron gave birth to George Gordon Byron at London on 22 January 1788 .
11 13	Frances Drummond gave birth to Mary Ann Drummond at Manchester on 01 January 1862 .
12 14	Emily Margaret Moore gave birth to Emily Susan Christian at Cheltenham on 01 January 1866 .
12 14	Elizabeth Dickens gave birth to Charles John Huffam Dickens at Landport on 07 February 1812 .
12 14	Elizabeth Dickens gave birth to Charles John Huffam Dickens at Portsmouth on 07 February 1812 .
11 13	Agnes Stenhouse gave birth to Thomas Lauder Brunton at Roxburgh on 14 March 1844 .
12 14	Gayle Conelly Manchin gave birth to Heather Manchin at West Virginia on 27 June 1969 .
13 15	Adelaide Howard Childs Frick gave birth to Helen Clay Frick at Pittsburgh on 01 January 1888 .
11 13	Eliza Wright Osborne gave birth to Helen Osborne at Auburn on 22 September 1864 .
12 14	Debra Antney gave birth to Juaquin James Malphurs at South Jamaica on 31 May 1986 .
13 15	Harriet Gambier gave birth to Henrietta Georgiana Marcia Lascelles Iremonger at London on 11 November 1806 .
11 13	Emily Griffith gave birth to William Griffith Wilson at Dorset on 26 November 1895 .
13 15	Sarah Maria Nott gave birth to Henry Codman Potter I at Schenectady on 25 May 1835 .
13 15	Sarah Maria Nott gave birth to Henry Codman Potter I at Schenectady on 01 January 1834 .
11 13	Janet Rennie gave birth to Henry Thomas Cockburn at Cockpen on 26 October 1779 .
11 13	Marion Harland gave birth to Virginia Belle Terhune at Newark on 21 May 1865 .
12 14	Mama Plankton gave birth to Sheldon James Plankton at Bikini Bottom on 30 November 1942 .
12 14	Eugenia Lillian Fauci gave birth to Anthony Stephen Fauci at Brooklyn on 24 December 1940 .
13 15	Asombi Bojang gave birth to Yahya Abdul-Aziz Jemus Junkung Jammeh at Kanilai on 25 May 1965 .
12 14	Tshering Yangdon gave birth to Jigme Khesar Namgyel Wangchuck at Kathmandu on 21 February 1980 .
11 13	Emily Gipps gave birth to Walter Howard Frere at Cambridge on 23 November 1863 .
11 13	Emily Gipps gave birth to Walter Howard Frere at Cambridge on 01 January 1863 .
11 13	Kate Prichard gave birth to Hesketh Vernon Prichard at Jhansi on 17 November 1876 .
12 14	Kris Jenner gave birth to Kourtney Mary Kardashian at Beverly Hills on 18 April 1979 .
17 19	Eileen Paisley, Baroness Paisley of St George\'s gave birth to Ian Richard Kyle Paisley at Belfast on 12 December 1966 .
17 19	Eileen Paisley, Baroness Paisley of St George\'s gave birth to Ian Richard Kyle Paisley at Belfast on 01 January 1966 .
13 15	Oveta Culp Hobby gave birth to William Pettus Hobby, Jr. at Houston on 19 January 1932 .
11 13	Anne Squire gave birth to Anne Mary Flower at London on 04 January 1790 .
15 17	Mary Williamson Averell gave birth to Edward Roland Noel Harriman at New York City on 24 December 1895 .
11 13	Maria Mott gave birth to Anna Coffin Davis at Philadelphia on 21 April 1838 .
12 14	Elizabeth Rees-Williams gave birth to Tudor St. John Harris at Whitechapel on 15 May 1963 .
11 13	Maria Coppola gave birth to Antonio Francesco Coppola at Brooklyn on 21 March 1917 .
13 15	Martha W. Hart gave birth to Charles Robert Redford at Santa Monica on 18 August 1936 .
13 15	Autumn Phillips gave birth to Isla Elizabeth Phillips at Gloucestershire Royal Hospital on 29 March 2012 .
11 13	Lucille Hendrix gave birth to Johnny Allen Hendrix at Seattle on 27 November 1942 .
12 14	Marguerite Perrin gave birth to Ashley Nicole Perrin at Baton Rouge on 13 January 1982 .
11 13	Michelle Duggar gave birth to Jackson Levi Duggar at Tontitown on 23 May 2004 .
13 15	Cynthia Spencer, Countess Spencer gave birth to Edward John Spencer at London on 24 January 1924 .
11 13	Neilia Hunter gave birth to Robert Hunter Biden at Wilmington on 04 February 1970 .
11 13	Charlotte Estwick gave birth to William Thomas Denison at London on 03 May 1804 .
12 14	Kourtney Kardashian gave birth to Reign Aston Disick at Los Angeles on 14 December 2014 .
12 14	Blac Chyna gave birth to King Cairo Stevenson at Los Angeles on 16 October 2012 .
11 13	Marni Nixon gave birth to Andrew Maurice Gold at Burbank on 02 August 1951 .
11 13	Isabelle Acheson gave birth to John Maclean at Duart Castle on 01 January 1604 .
11 13	Angela Thorne gave birth to Laurence David Penry-Jones at London on 01 August 1977 .
11 13	Shontell McClain gave birth to Lauryn Alisa McClain at Decatur on 09 January 1997 .
11 13	Eleanor Sharwood gave birth to Stephen Ian Fairbairn at Melbourne on 14 April 1896 .
12 14	Mary Perry Bingham gave birth to Frances Payne Bingham at Cleveland on 29 March 1885 .
14 16	Jijabai Shahaji Bhosale gave birth to Shivaji Rao Gaekwad at Nachikuppam Gram Panchayat on 12 December 1950 .
10 12	Bridget Bourke gave birth to Maria Gunning at Huntingdonshire on 01 January 1733 .
11 13	Maria Murray gave birth to Milo George Talbot at Malahide on 01 January 1854 .
12 14	Frances Duke Coleridge gave birth to John Coleridge Patteson at London on 01 April 1827 .
11 13	Mary Butler gave birth to Olivia Frances Fitzmaurice at Gwenfain on 11 November 1858 .
13 15	Katharine Buckner McVickar gave birth to Katharine Edith Carlotta Norton at London on 18 December 1883 .
11 13	Hannah Chaplin gave birth to Sydney John Hill at London on 16 March 1885 .
11 13	Margaret Shenberg gave birth to Irene Gladys Mayer at Brooklyn on 02 April 1907 .
11 13	Charlotte Bloomberg gave birth to Michael Rubens Bloomberg at Boston on 14 February 1942 .
11 13	Jessica Smith gave birth to Gordon Harold Smith at Pendleton on 25 May 1952 .
10 12	Marjorie Pym gave birth to Anne Acland-Troyte at Kensington on 12 June 1912 .
13 15	Lady Mary-Gaye Curzon gave birth to Isabella Amaryllis Charlotte Anstruther-Gough-Calthorpe at Winchester on 03 March 1980 .
11 13	Rosario Moreno gave birth to Francisco Moreno Domagoso at Tondo on 24 October 1974 .
14 16	Margaret Livingston Stuyvesant gave birth to Jonathan Mayhew Wainwright at New York City on 10 December 1864 .
12 14	Afeni Shakur gave birth to Lesane Parish Crooks at East Harlem on 16 June 1971 .
11 13	Sally Bostwick gave birth to Jabez Abel Bostwick at Delhi on 23 September 1830 .
14 16	Mary Fox gave birth to Joseph Albert Pease, 1st Baron Gainford at Darlington on 17 January 1860 .
11 13	Etterlene DeBarge gave birth to James Curtis DeBarge at Detroit on 22 August 1963 .
13 15	Anne Maria Perry gave birth to James Jackson Storrow II at Boston on 01 January 1864 .
12 14	Marie Ignatius Murphy gave birth to Marie Annette Reiss at Qingdao on 12 August 1917 .
10 12	Charlotte Lamb gave birth to Jane Holland at Ilford on 17 November 1966 .
10 12	Abiah Folger gave birth to Jane Franklin at Boston on 01 January 1712 .
12 14	Clara Horwitz gave birth to Gertrude Freudenberg at New York City on 27 September 1863 .
12 14	Olivia Langdon Clemens gave birth to Jane Lampton Clemens at Hartford on 26 July 1880 .
11 13	Wendy Hodge gave birth to Jemma Madeleine Kidd at Guildford on 20 September 1974 .
12 14	Patti D\'Arbanville gave birth to Jesse Wayne Johnson at Los Angeles on 07 December 1982 .
12 14	Ellen Axson Wilson gave birth to Jessie Woodrow Wilson at Gainesville on 28 August 1887 .
10 12	Sophia Weber gave birth to Eloise Lindauer at Manhattan on 01 April 1852 .
11 13	Anne Bladen gave birth to Benjamin Tasker Jr. at Annapolis on 01 January 1720 .
10 12	Рамзия Гарашова gave birth to FARHAD GARASHOV at Baku on 12 December 1986 .
18 20	Catherine Dent gave birth to John Graham Hope Horsley de la Poer Beresford at Newcastle upon Tyne on 05 December 1866 .
12 14	Ada Armstrong gave birth to Lindley Armstrong Jones at Long Beach on 14 December 1911 .
15 17	Mary Agnes La Trobe gave birth to John Frederick La Trobe Bateman at Halifax on 30 May 1810 .
15 17	Mary Agnes La Trobe gave birth to John Frederick La Trobe Bateman at Halifax on 01 January 1810 .
12 14	Margaret Willing Hare gave birth to John Powel Hare at Philadelphia on 01 January 1786 .
12 14	Elizabeth Willing Powel gave birth to John Powel Hare at Philadelphia on 01 January 1786 .
13 15	Brigit Holmquist gave birth to Birgitte Caroline von Schlebrügge at Mexico City on 08 January 1941 .
10 12	Margaret gave birth to John Saul Howson at Giggleswick on 05 May 1816 .
12 14	Marie Salóme Juliar gave birth to John Nicholas Ringling at McGregor on 31 May 1866 .
11 13	Helena Lefevre gave birth to John George Shaw-Lefevre at London on 24 January 1797 .
12 14	Frances Duke Taylor gave birth to John Taylor Coleridge at Tiverton on 09 July 1790 .
13 15	Flora Guest gave birth to John Bigelow Dodge at New York City on 15 May 1894 .
11 13	Gloria Carter gave birth to Shawn Corey Carter at Brooklyn on 04 December 1969 .
12 14	Beverly Pepper gave birth to Jorie Pepper at New York City on 09 May 1950 .
12 14	Beverly Pepper gave birth to Jorie Pepper at New York City on 01 January 1951 .
11 13	Emilie Brentano gave birth to Ludwig Joseph Brentano at Aschaffenburg on 18 December 1844 .
12 14	Edith Sophia Sthole gave birth to Murry Gage Wilson at Hutchinson on 02 July 1917 .
14 16	Meghan, Duchess of Sussex gave birth to Archie Harrison Mountbatten-Windsor at Portland Hospital on 06 May 2019 .
13 15	Dorothy Howell Rodham gave birth to Hillary Diane Rodham at Edgewater Hospital on 26 October 1947 .
11 13	Mary Cooper gave birth to Sheldon Lee Cooper at Galveston on 26 February 1980 .
13 15	Ida Marie Honoré gave birth to Julia Dent Grant at White House on 06 June 1876 .
11 13	Amelia Yeomans gave birth to Lilian Barbara Yeomans at Madoc on 23 June 1861 .
13 15	Lynne Andrew gave birth to Michael Bruce John Murray at Louis Trichardt on 05 March 1985 .
12 14	Frances Alicia Peebles gave birth to Alfred Dickinson Price at Wicklow on 16 September 1857 .
14 16	Valerie Mathilde Wilhelmina Abraham gave birth to Irene Louise Gertrude Marinoff at Hove on 20 September 1901 .
11 13	Mary Martha Sherwood gave birth to Sophia Sherwood at India on 01 January 1815 .
13 15	Rose Weigall gave birth to William Ernest George Archibald Weigall at London on 08 December 1874 .
10 12	Catherine Innes gave birth to Catherine Gordon at Banff on 01 January 1763 .
10 12	Catherine Innes gave birth to Catherine Gordon at Banff on 22 April 1764 .
10 12	Catherine Innes gave birth to Catherine Gordon at Banff on 01 January 1765 .
13 15	Zara Tindall gave birth to Lena Elizabeth Tindall at Stroud Maternity Hospital on 18 June 2018 .
12 14	Eleanor Percy Lee gave birth to Catherine Sarah Lee at Lexington on 03 November 1841 .
12 14	Charlotte Fanning Stewart gave birth to Katharine Marjory Ramsay at Edinburgh on 06 November 1874 .
